id,name,subtitle,description
1,Agresión a periodistas,"Lorem ipsum dolor sit amet, consectetur adipiscing elit.","In egestas dolor elit, vitae maximus nisi vehicula sed. Phasellus non magna viverra, suscipit metus quis, suscipit nunc. Etiam aliquam, enim eget mattis sollicitudin, ex massa laoreet arcu, eget ornare tortor lectus sit amet urna. Suspendisse potenti. Mauris vestibulum lectus in ante ultrices, in auctor elit lacinia. "
2,El siniestro doctor Mortis,"Cras ac scelerisque ex. Aenean varius efficitur lectus, sit amet dictum lectus. Sed quis fringilla risus.","Cras augue mauris, congue in enim sagittis, tincidunt tempor neque. Fusce mi lectus, sodales in quam ac, viverra porttitor lectus. Proin rhoncus in erat vitae ultrices. Sed a nulla nibh. Orci varius natoque penatibus et magnis dis parturient montes, nascetur ridiculus mus. Mauris tempor urna vitae ipsum tristique luctus."
3,Entrevista a Domingo Marileo,Noticiero en español conducido por Alejandro Valente,"Etiam a justo et enim laoreet tristique. Phasellus vehicula volutpat enim sed blandit. Aenean eu metus nisi. Aenean nec sagittis ligula. Nam sed porttitor eros. Sed ullamcorper placerat gravida. Integer malesuada mi eget enim egestas ultrices a ut mauris."
4,Gladys Marin,"Duis a libero scelerisque, maximus enim non, sagittis urna.","Sed mattis condimentum mauris, at volutpat massa venenatis et. Quisque sit amet ante velit. Curabitur ligula nunc, tristique a eros quis, ullamcorper porttitor dolor. In sit amet mattis libero, in tempor quam. Nullam consectetur dui ut accumsan tincidunt. Pellentesque quis ornare dolor, in efficitur tortor. Donec scelerisque, quam sit amet sodales accumsan, eros augue rhoncus nisi, nec congue arcu erat et turpis. "
5,Homenaje a Pablo Neruda,"Class aptent taciti sociosqu ad litora torquent per conubia nostra, per inceptos himenaeos.",Nulla ornare enim vitae lacus porttitor accumsan eu vitae dui. Proin laoreet dictum dui ultrices mollis. Pellentesque habitant morbi tristique senectus et netus et malesuada fames ac turpis egestas. Morbi a orci ex. Sed sed egestas turpis. Phasellus porttitor lorem eget odio faucibus condimentum. Curabitur tempus et dui ut pretium. 
6,Nuestro Canto, prohibición Serrat,"Praesent dapibus, ipsum in fringilla vestibulum, neque massa vehicula turpis, ut mollis nunc lorem ut lectus. In non semper diam.","Donec eu orci malesuada, mattis dui quis, sagittis lectus. In feugiat magna non neque vestibulum tincidunt. Orci varius natoque penatibus et magnis dis parturient montes, nascetur ridiculus mus. Maecenas eget lectus fermentum, egestas felis nec, commodo nibh."
7,Restricción de la información,Ut malesuada est et est laoreet condimentum. Praesent tempor faucibus scelerisque.,Etiam a justo et enim laoreet tristique. Phasellus vehicula volutpat enim sed blandit. Aenean eu metus nisi. Aenean nec sagittis ligula. Nam sed porttitor eros. Sed ullamcorper placerat gravida. Integer malesuada mi eget enim egestas ultrices a ut mauris. 
8,Saludo CODEM,Vivamus tincidunt id arcu sed pellentesque. Nulla at imperdiet dui. Vivamus maximus sapien at lacinia placerat.,"Aenean nec pharetra magna. Pellentesque volutpat elit sit amet dolor interdum viverra. In accumsan ornare justo eget sollicitudin. Nunc accumsan risus ante, in suscipit ante eleifend quis. "
9,Suspende radio por caso Anfruns,Vivamus tincidunt id arcu sed pellentesque. Nulla at imperdiet dui. Vivamus maximus sapien at lacinia placerat.,"Aenean nec pharetra magna. Pellentesque volutpat elit sit amet dolor interdum viverra. In accumsan ornare justo eget sollicitudin. Nunc accumsan risus ante, in suscipit ante eleifend quis. "
10,Teatro Familiar Barrio,Vivamus tincidunt id arcu sed pellentesque. Nulla at imperdiet dui. Vivamus maximus sapien at lacinia placerat.,"Aenean nec pharetra magna. Pellentesque volutpat elit sit amet dolor interdum viverra. In accumsan ornare justo eget sollicitudin. Nunc accumsan risus ante, in suscipit ante eleifend quis. "
11,Tribunal Laboral,Vivamus tincidunt id arcu sed pellentesque. Nulla at imperdiet dui. Vivamus maximus sapien at lacinia placerat.,"Aenean nec pharetra magna. Pellentesque volutpat elit sit amet dolor interdum viverra. In accumsan ornare justo eget sollicitudin. Nunc accumsan risus ante, in suscipit ante eleifend quis. "
12,Voces de Dawson,Vivamus tincidunt id arcu sed pellentesque. Nulla at imperdiet dui. Vivamus maximus sapien at lacinia placerat.,"Aenean nec pharetra magna. Pellentesque volutpat elit sit amet dolor interdum viverra. In accumsan ornare justo eget sollicitudin. Nunc accumsan risus ante, in suscipit ante eleifend quis. "
